<!ELEMENT dataset (
    ACTION_CONFIG*,
    ACTION_CONFIG_DETAIL*,
    ACTION_RESULT*,
    ACTION_SET*,
    ACTIVITY*,
    ACTIVITY_FILTER*,
    ACTIVITY_FREQUENCY*,
    ACTIVITY_PROPERTY*,
    ACTIVITY_TARGET_GROUP*,
    ACTIVITY_TARGET_GROUP_DETAILS*,
    CAMPAIGN*,
    CONDITION*,
    CONDITION_GROUP*,
    CONDITION_SET*,
    CONDITION_VALUE*,
    COUNTRY*,
    COUNTY*,
    CRON_EXPRESSION*,
    EPS_CONDITION*,
    EPS_CONDITION_RESULT*,
    EPS_CONDITION_SET*,
    EXCLUSION_DATE*,
    LANGUAGE*,
    LVALUE*,
    OPERATOR*,
    PLAYER_DISTRIBUTION*,
    TAG*,
    VALUE_DESCRIPTOR*,
    VALUE_GROUP*,
    VALUE_INPUT_TYPE*,
    VALUE_PROVIDER*,
    VALUE_VALIDATOR*)>

<!ELEMENT ACTION_CONFIG EMPTY>
<!ATTLIST ACTION_CONFIG
    ACTION_CONFIG_ID CDATA #REQUIRED
    ACTION_ORDER CDATA #IMPLIED
    BEAN_NAME CDATA #IMPLIED
    NAME CDATA #REQUIRED
    ACTION_TYPE CDATA #REQUIRED
    ACTION_SET_ID CDATA #REQUIRED
    LABEL CDATA #IMPLIED
>

<!ELEMENT ACTION_CONFIG_DETAIL EMPTY>
<!ATTLIST ACTION_CONFIG_DETAIL
    ACTION_CONFIG_DETAIL_ID CDATA #REQUIRED
    CONFIG_KEY CDATA #REQUIRED
    CONFIG_VALUE CDATA #IMPLIED
    ACTION_CONFIG_ID CDATA #IMPLIED
    DYNAMIC CDATA #REQUIRED
>

<!ELEMENT ACTION_RESULT EMPTY>
<!ATTLIST ACTION_RESULT
    ACTION_RESULT_ID CDATA #REQUIRED
    ACTION_STATUS CDATA #IMPLIED
    END_DATE CDATA #IMPLIED
    START_DATE CDATA #REQUIRED
    ACTION_CONFIG_ID CDATA #REQUIRED
    ACTIVITY_ID CDATA #REQUIRED
    CAMPAIGN_ID CDATA #IMPLIED
    TARGET_GROUP_ID CDATA #REQUIRED
    PLAYER_NAME CDATA #IMPLIED
    CASINO_NAME CDATA #IMPLIED
    ACTION_SET_INVOCATION_ID CDATA #REQUIRED
>

<!ELEMENT ACTION_SET EMPTY>
<!ATTLIST ACTION_SET
    ACTION_SET_ID CDATA #REQUIRED
>

<!ELEMENT ACTIVITY EMPTY>
<!ATTLIST ACTIVITY
    ACTIVITY_ID CDATA #REQUIRED
    APPROVED_BY CDATA #IMPLIED
    APPROVED_DATE CDATA #IMPLIED
    CREATED_BY CDATA #IMPLIED
    CREATED_DATE CDATA #IMPLIED
    DESCRIPTION CDATA #IMPLIED
    END_DATE CDATA #IMPLIED
    LABEL CDATA #IMPLIED
    NAME CDATA #REQUIRED
    OPT_IN CDATA #REQUIRED
    PUBLICATION_DATE CDATA #IMPLIED
    START_DATE CDATA #REQUIRED
    STATUS_NAME CDATA #REQUIRED
    TEST CDATA #REQUIRED
    UPDATED_BY CDATA #IMPLIED
    UPDATED_DATE CDATA #IMPLIED
    CAMPAIGN_ID CDATA #IMPLIED
    CASINO_ID CDATA #IMPLIED
    CASINO_NAME CDATA #IMPLIED
    ACTIVITY_FILTER_ID CDATA #IMPLIED
>

<!ELEMENT ACTIVITY_FILTER EMPTY>
<!ATTLIST ACTIVITY_FILTER
    TYPE CDATA #REQUIRED
    ACTIVITY_FILTER_ID CDATA #REQUIRED
    DESCRIPTION CDATA #REQUIRED
    NAME CDATA #REQUIRED
    EVENT_TYPE CDATA #IMPLIED
    CASINO CDATA #IMPLIED
    CLIENT_TYPE CDATA #IMPLIED
    PLATFORM CDATA #IMPLIED
    START_DATE CDATA #IMPLIED
    LANGUAGE_ID CDATA #IMPLIED
>

<!ELEMENT ACTIVITY_FREQUENCY EMPTY>
<!ATTLIST ACTIVITY_FREQUENCY
    ACTIVITY_FREQUENCY_ID CDATA #REQUIRED
    MAX_TIMES CDATA #REQUIRED
    PERIOD_QUALIFIER CDATA #IMPLIED
    TIMEUNIT CDATA #REQUIRED
    TIMEUNIT_NUMBER CDATA #REQUIRED
    WEEKDAYS_MAP CDATA #REQUIRED
    ACTIVITY_ID CDATA #REQUIRED
>

<!ELEMENT ACTIVITY_PROPERTY EMPTY>
<!ATTLIST ACTIVITY_PROPERTY
    ACTIVITY_ID CDATA #REQUIRED
    VALUE CDATA #IMPLIED
    KEY CDATA #REQUIRED
>

<!ELEMENT ACTIVITY_TARGET_GROUP EMPTY>
<!ATTLIST ACTIVITY_TARGET_GROUP
    ACTIVITY_TARGET_GROUP_ID CDATA #REQUIRED
    CONTROL CDATA #REQUIRED
    NAME CDATA #REQUIRED
    PERCENT CDATA #REQUIRED
    ACTION_SET_ID CDATA #IMPLIED
    ACTIVITY_ID CDATA #IMPLIED
    LABEL CDATA #IMPLIED
>

<!ELEMENT ACTIVITY_TARGET_GROUP_DETAILS EMPTY>
<!ATTLIST ACTIVITY_TARGET_GROUP_DETAILS
    ATG_DETAILS_ID CDATA #REQUIRED
    ACTIVITY_TARGET_GROUP_ID CDATA #REQUIRED
    UNIQUE_PLAYERS_ACTIONED CDATA #REQUIRED
>

<!ELEMENT CAMPAIGN EMPTY>
<!ATTLIST CAMPAIGN
    CAMPAIGN_ID CDATA #REQUIRED
    APPROVED_BY CDATA #IMPLIED
    APPROVED_DATE CDATA #IMPLIED
    CATEGORY_ID CDATA #REQUIRED
    CREATED_BY CDATA #IMPLIED
    CREATED_DATE CDATA #IMPLIED
    DESCRIPTION CDATA #IMPLIED
    END_DATE CDATA #IMPLIED
    LABEL CDATA #REQUIRED
    LINKS CDATA #IMPLIED
    NAME CDATA #REQUIRED
    PUBLICATION_DATE CDATA #IMPLIED
    START_DATE CDATA #IMPLIED
    STATUS_NAME CDATA #REQUIRED
    UPDATED_BY CDATA #IMPLIED
    UPDATED_DATE CDATA #IMPLIED
    DERIVED_DATES CDATA #IMPLIED
    CASINO_ID CDATA #IMPLIED
    CASINO_NAME CDATA #IMPLIED
>

<!ELEMENT CONDITION EMPTY>
<!ATTLIST CONDITION
    CONDITION_ID CDATA #REQUIRED
    EXPRESSION CDATA #IMPLIED
    NAME CDATA #IMPLIED
    STORE_STATE CDATA #REQUIRED
    WEIGHT CDATA #REQUIRED
    CONDITION_GROUP_ID CDATA #REQUIRED
    LVALUE CDATA #IMPLIED
    OPERATOR_GROUP CDATA #IMPLIED
    OPERATOR CDATA #IMPLIED
    LABEL CDATA #REQUIRED
>

<!ELEMENT CONDITION_GROUP EMPTY>
<!ATTLIST CONDITION_GROUP
    CONDITION_GROUP_ID CDATA #REQUIRED
    NAME CDATA #IMPLIED
    CONDITION_SET_ID CDATA #REQUIRED
    LABEL CDATA #REQUIRED
    TYPE CDATA #REQUIRED
    DESCRIPTION CDATA #IMPLIED
>

<!ELEMENT CONDITION_SET EMPTY>
<!ATTLIST CONDITION_SET
    CONDITION_SET_ID CDATA #REQUIRED
    NAME CDATA #IMPLIED
    ACTIVITY_ID CDATA #IMPLIED
    LABEL CDATA #IMPLIED
    DESCRIPTION CDATA #IMPLIED
>

<!ELEMENT CONDITION_VALUE EMPTY>
<!ATTLIST CONDITION_VALUE
    CONDITION_ID CDATA #IMPLIED
    VALUE CDATA #IMPLIED
    IDX CDATA #IMPLIED
>

<!ELEMENT COUNTRY EMPTY>
<!ATTLIST COUNTRY
    COUNTRY_ID CDATA #REQUIRED
    CODE CDATA #REQUIRED
    COUNTRY_NAME CDATA #REQUIRED
>

<!ELEMENT COUNTY EMPTY>
<!ATTLIST COUNTY
    COUNTY_ID CDATA #REQUIRED
    CODE CDATA #REQUIRED
    COUNTY_NAME CDATA #REQUIRED
    COUNTRY_ID CDATA #IMPLIED
>

<!ELEMENT CRON_EXPRESSION EMPTY>
<!ATTLIST CRON_EXPRESSION
    ACTIVITY_FILTER_ID CDATA #REQUIRED
    CRON_EXPRESSION CDATA #REQUIRED
    IDX CDATA #REQUIRED
>

<!ELEMENT EPS_CONDITION EMPTY>
<!ATTLIST EPS_CONDITION
    ID CDATA #REQUIRED
    CONDITION_SET_ID CDATA #REQUIRED
    EXPRESSION CDATA #REQUIRED
    HAS_STATE CDATA #REQUIRED
    TRIGGER_TYPE CDATA #IMPLIED
>

<!ELEMENT EPS_CONDITION_RESULT EMPTY>
<!ATTLIST EPS_CONDITION_RESULT
    ID CDATA #REQUIRED
    CONDITION_ID CDATA #REQUIRED
    PLAYER_NAME CDATA #REQUIRED
    CASINO_NAME CDATA #REQUIRED
    EVALUATION_DATE CDATA #REQUIRED
>

<!ELEMENT EPS_CONDITION_SET EMPTY>
<!ATTLIST EPS_CONDITION_SET
    ID CDATA #REQUIRED
    LABEL CDATA #REQUIRED
    START_DATE CDATA #REQUIRED
    END_DATE CDATA #IMPLIED
    DESTINATION CDATA #REQUIRED
    REPLY_TO CDATA #REQUIRED
    ACTIVE CDATA #REQUIRED
    EXPLICIT_LABEL CDATA #IMPLIED
    CASINO_NAME CDATA #REQUIRED
>

<!ELEMENT EXCLUSION_DATE EMPTY>
<!ATTLIST EXCLUSION_DATE
    ACTIVITY_FILTER_ID CDATA #REQUIRED
    EXCLUSION_DATE CDATA #IMPLIED
    IDX CDATA #IMPLIED
>

<!ELEMENT LANGUAGE EMPTY>
<!ATTLIST LANGUAGE
    LANGUAGE_ID CDATA #REQUIRED
    CODE CDATA #REQUIRED
    NAME CDATA #REQUIRED
>

<!ELEMENT LVALUE EMPTY>
<!ATTLIST LVALUE
    LVALUE_ID CDATA #REQUIRED
    ALLOW_ADD CDATA #REQUIRED
    ALLOW_DELETE CDATA #REQUIRED
    DEFAULT_POSITION CDATA #IMPLIED
    DEFAULT_VALUE CDATA #IMPLIED
    DESCRIPTION CDATA #IMPLIED
    EXPRESSION CDATA #REQUIRED
    FROM_VALUE_PROVIDER_ONLY CDATA #REQUIRED
    MAIN_CONDITION CDATA #REQUIRED
    MESSAGE_TEMPLATE CDATA #REQUIRED
    NAME CDATA #REQUIRED
    WEIGHT CDATA #REQUIRED
    VALUE_DESCRIPTOR_ID CDATA #REQUIRED
    VALUE_GROUP_ID CDATA #IMPLIED
>

<!ELEMENT OPERATOR EMPTY>
<!ATTLIST OPERATOR
    OPERATOR_ID CDATA #REQUIRED
    EXPRESSION CDATA #REQUIRED
    NAME CDATA #REQUIRED
    RVALUE_INPUT_TYPE_ID CDATA #IMPLIED
    VALUE_DESCRIPTOR_ID CDATA #IMPLIED
>

<!ELEMENT PLAYER_DISTRIBUTION EMPTY>
<!ATTLIST PLAYER_DISTRIBUTION
    PLAYER_DISTRIBUTION_ID CDATA #REQUIRED
    ACTIVITY_TARGET_GROUP_ID CDATA #REQUIRED
    PLAYER_NAME CDATA #IMPLIED
    CASINO_NAME CDATA #IMPLIED
    DISTRIBUTION_DATE CDATA #IMPLIED
>

<!ELEMENT TAG EMPTY>
<!ATTLIST TAG
    TAG_ID CDATA #REQUIRED
    VALUE CDATA #REQUIRED
    CAMPAIGN_ID CDATA #REQUIRED
>

<!ELEMENT VALUE_DESCRIPTOR EMPTY>
<!ATTLIST VALUE_DESCRIPTOR
    VALUE_DESCRIPTOR_ID CDATA #REQUIRED
    NAME CDATA #REQUIRED
    TYPE CDATA #REQUIRED
>

<!ELEMENT VALUE_GROUP EMPTY>
<!ATTLIST VALUE_GROUP
    VALUE_GROUP_ID CDATA #REQUIRED
    NAME CDATA #REQUIRED
>

<!ELEMENT VALUE_INPUT_TYPE EMPTY>
<!ATTLIST VALUE_INPUT_TYPE
    VALUE_INPUT_TYPE_ID CDATA #REQUIRED
    INPUT_TYPE CDATA #REQUIRED
>

<!ELEMENT VALUE_PROVIDER EMPTY>
<!ATTLIST VALUE_PROVIDER
    VALUE_PROVIDER_ID CDATA #REQUIRED
    EXPRESSION CDATA #REQUIRED
    NAME CDATA #REQUIRED
    LVALUE_ID CDATA #IMPLIED
>

<!ELEMENT VALUE_VALIDATOR EMPTY>
<!ATTLIST VALUE_VALIDATOR
    VALUE_VALIDATOR_ID CDATA #REQUIRED
    FAIL_MESSAGE_TEMPLATE CDATA #REQUIRED
    REGEXP CDATA #REQUIRED
    LVALUE_ID CDATA #IMPLIED
>

