<?xml version='1.0' encoding='UTF-8'?>
<!DOCTYPE dataset SYSTEM "dbunit-dataset.dtd">
<dataset>
    <CAMPAIGN
            CAMPAIGN_ID="10001"
            DERIVED_DATES="0"
            APPROVED_BY="tumakha"
            APPROVED_DATE="2012-01-01 11:06:41.114000000"
            CASINO_NAME="playtech81004"
            CASINO_ID="81004"
            CATEGORY_ID="ACQUISITION"
            CREATED_BY="dedr"
            CREATED_DATE="2012-01-01 11:06:41.114000000"
            DESCRIPTION="In design status"
            END_DATE="2010-01-01 11:06:41"
            LABEL="camp.1"
            LINKS="http://www.sometest.kiev.ua"
            NAME="In Design"
            PUBLICATION_DATE="2012-01-01 11:06:41.114000000"
            START_DATE="2010-01-01 11:06:41"
            STATUS_NAME="IN_DESIGN"
            UPDATED_BY="zxczxc"
            UPDATED_DATE="2012-01-01 11:06:41.114000000"
            />
    <ACTIVITY
            ACTIVITY_ID="20001"
            END_DATE="2020-01-01 00:00:00.0"
            LABEL="eb12ee5b-e96f-4347-8f03-23b3fb391a30"
            NAME="Activity 1"
            OPT_IN="0"
            PUBLICATION_DATE="2012-08-29 13:41:00.0"
            START_DATE="2012-08-29 13:41:00.0"
            STATUS_NAME="IN_DESIGN"
            TEST="0"
            CAMPAIGN_ID="10001"
            />
    <CAMPAIGN
            CAMPAIGN_ID="10002"
            DERIVED_DATES="0"
            APPROVED_BY="tumakha"
            APPROVED_DATE="2012-01-01 11:06:41.114000000"
            CASINO_NAME="playtech81004"
            CASINO_ID="81004"
            CATEGORY_ID="RETENTION"
            CREATED_BY="tumakha"
            CREATED_DATE="2012-01-01 11:06:41.114000000"
            DESCRIPTION="Approved status"
            END_DATE="2020-01-01 11:06:41"
            LABEL="camp.2"
            LINKS="links"
            NAME="Approved"
            PUBLICATION_DATE="2012-01-01 11:06:41.114000000"
            START_DATE="2015-01-01 11:06:41"
            STATUS_NAME="APPROVED"
            UPDATED_BY="zxczxc"
            UPDATED_DATE="2012-01-01 11:06:41.114000000"
            />
    <ACTIVITY
            ACTIVITY_ID="20002"
            END_DATE="2020-01-01 00:00:00.0"
            LABEL="eb12ee5b-e96f-4347-8f03-23b3fb391a30"
            NAME="Activity 1"
            OPT_IN="0"
            PUBLICATION_DATE="2012-08-29 13:41:00.0"
            START_DATE="2012-08-29 13:41:00.0"
            STATUS_NAME="IN_DESIGN"
            TEST="0"
            CAMPAIGN_ID="10002"
            />
    <CAMPAIGN
            CAMPAIGN_ID="10003"
            DERIVED_DATES="0"
            APPROVED_BY="tumakha"
            APPROVED_DATE="2012-01-01 11:06:41.114000000"
            CASINO_ID="81004"
            CASINO_NAME="playtech81004"
            CATEGORY_ID="CONVERSION"
            CREATED_BY="tumakha"
            CREATED_DATE="2012-01-01 11:06:41.114000000"
            DESCRIPTION="Active status"
            END_DATE="2020-01-01 11:06:41"
            LABEL="camp.3"
            LINKS="links"
            NAME="Active"
            PUBLICATION_DATE="2012-01-01 11:06:41.114000000"
            START_DATE="2010-01-01 11:06:41"
            STATUS_NAME="ACTIVE"
            UPDATED_BY="zxczxc"
            UPDATED_DATE="2012-01-01 11:06:41.114000000"
            />
    <ACTIVITY
            ACTIVITY_ID="20003"
            END_DATE="2020-01-01 00:00:00.0"
            LABEL="eb12ee5b-e96f-4347-8f03-23b3fb391a30"
            NAME="Activity 1"
            OPT_IN="0"
            PUBLICATION_DATE="2012-08-29 13:41:00.0"
            START_DATE="2012-08-29 13:41:00.0"
            STATUS_NAME="IN_DESIGN"
            TEST="0"
            CAMPAIGN_ID="10003"
            />
    <CAMPAIGN
            CAMPAIGN_ID="10004"
            DERIVED_DATES="0"
            APPROVED_BY="tumakha"
            APPROVED_DATE="2012-01-01 11:06:41.114000000"
            CASINO_ID="81004"
            CASINO_NAME="playtech81004"
            CATEGORY_ID="CROSS_MARKETING"
            CREATED_BY="tumakha"
            CREATED_DATE="2012-01-01 11:06:41.114000000"
            DESCRIPTION="Completed"
            END_DATE="2010-01-01 11:06:41"
            LABEL="camp.4"
            LINKS="links"
            NAME="Completed"
            PUBLICATION_DATE="2012-01-01 11:06:41.114000000"
            START_DATE="2009-01-01 11:06:41"
            STATUS_NAME="COMPLETED"
            UPDATED_BY="zxczxc"
            UPDATED_DATE="2012-01-01 11:06:41.114000000"
            />
    <ACTIVITY
            ACTIVITY_ID="20004"
            END_DATE="2020-01-01 00:00:00.0"
            LABEL="eb12ee5b-e96f-4347-8f03-23b3fb391a30"
            NAME="Activity 1"
            OPT_IN="0"
            PUBLICATION_DATE="2012-08-29 13:41:00.0"
            START_DATE="2012-08-29 13:41:00.0"
            STATUS_NAME="IN_DESIGN"
            TEST="0"
            CAMPAIGN_ID="10004"
            />
    <CAMPAIGN
            CAMPAIGN_ID="10005"
            DERIVED_DATES="0"
            APPROVED_BY="tumakha"
            APPROVED_DATE="2012-01-01 11:06:41.114000000"
            CASINO_ID="81004"
            CASINO_NAME="playtech81004"
            CATEGORY_ID="REACTIVATION"
            CREATED_BY="tumakha"
            CREATED_DATE="2012-01-01 11:06:41.114000000"
            DESCRIPTION="Disabled"
            END_DATE="2018-01-01 11:06:41"
            LABEL="camp.5"
            LINKS="links"
            NAME="Disabled"
            PUBLICATION_DATE="2012-01-01 11:06:41.114000000"
            START_DATE="2015-01-01 11:06:41"
            STATUS_NAME="DISABLED"
            UPDATED_BY="zxczxc"
            UPDATED_DATE="2012-01-01 11:06:41.114000000"
            />
    <ACTIVITY
            ACTIVITY_ID="20005"
            END_DATE="2020-01-01 00:00:00.0"
            LABEL="eb12ee5b-e96f-4347-8f03-23b3fb391a30"
            NAME="Activity 1"
            OPT_IN="0"
            PUBLICATION_DATE="2012-08-29 13:41:00.0"
            START_DATE="2012-08-29 13:41:00.0"
            STATUS_NAME="IN_DESIGN"
            TEST="0"
            CAMPAIGN_ID="10005"
            />
</dataset>
