<?xml version='1.0' encoding='UTF-8'?>
<!DOCTYPE dataset SYSTEM "dbunit-dataset.dtd">
<dataset>
    <CAMPAIGN
            CAMPAIGN_ID="10001"
            CASINO_ID="81004"
            CASINO_NAME="playtech81004"
            CATEGORY_ID="ACQUISITION"
            CREATED_BY="Denys_M"
            CREATED_DATE="2012-09-05 17:55:19.776"
            DERIVED_DATES="0"
            END_DATE="2020-01-01 00:00:00.0"
            LABEL="cmp1"
            NAME="In Design"
            PUBLICATION_DATE="2010-01-01 11:06:00.0"
            START_DATE="2010-01-01 11:06:00.0"
            STATUS_NAME="IN_DESIGN"
            UPDATED_BY="Denys_M"
            UPDATED_DATE="2012-09-05 17:59:04.818"
            />
    <ACTIVITY
            ACTIVITY_ID="11001"
            END_DATE="2020-01-01 00:00:00.0"
            LABEL="eb12ee5b-e96f-4347-8f03-23b3fb391a30"
            NAME="Activity 1"
            OPT_IN="0"
            PUBLICATION_DATE="2010-01-01 11:06:00.0"
            START_DATE="2010-01-01 11:06:00.0"
            STATUS_NAME="IN_DESIGN"
            TEST="0"
            CAMPAIGN_ID="10001"
            />
    <CAMPAIGN
            CAMPAIGN_ID="10002"
            CASINO_ID="81004"
            CASINO_NAME="playtech81004"
            CATEGORY_ID="ACQUISITION"
            CREATED_BY="Denys_M"
            CREATED_DATE="2012-09-05 17:55:19.776"
            DERIVED_DATES="0"
            END_DATE="2020-01-01 00:00:00.0"
            LABEL="cmp2"
            NAME="Approved"
            PUBLICATION_DATE="2010-01-01 11:06:00.0"
            START_DATE="2019-02-04 01:00:00.0"
            STATUS_NAME="APPROVED"
            UPDATED_BY="Denys_M"
            UPDATED_DATE="2012-09-05 17:59:04.818"
            />
    <ACTIVITY
            ACTIVITY_ID="11002"
            END_DATE="2020-01-01 00:00:00.0"
            LABEL="eb12ee5b-e96f-4347-8f03-23b3fb391a30"
            NAME="Activity 1"
            OPT_IN="0"
            PUBLICATION_DATE="2010-01-01 11:06:00.0"
            START_DATE="2019-02-04 01:00:00.0"
            STATUS_NAME="APPROVED"
            TEST="0"
            CAMPAIGN_ID="10002"
            />
    <CAMPAIGN
            CAMPAIGN_ID="10003"
            CASINO_ID="81004"
            CASINO_NAME="playtech81004"
            CATEGORY_ID="ACQUISITION"
            CREATED_BY="Denys_M"
            CREATED_DATE="2012-09-05 17:55:19.776"
            DERIVED_DATES="0"
            END_DATE="2020-01-01 00:00:00.0"
            LABEL="cmp3"
            NAME="Active"
            PUBLICATION_DATE="2010-01-01 11:06:00.0"
            START_DATE="2010-01-01 11:06:00.0"
            STATUS_NAME="ACTIVE"
            UPDATED_BY="Denys_M"
            UPDATED_DATE="2012-09-05 17:59:04.818"
            />
    <ACTIVITY
            ACTIVITY_ID="11003"
            END_DATE="2020-01-01 00:00:00.0"
            LABEL="eb12ee5b-e96f-4347-8f03-23b3fb391a30"
            NAME="Activity 1"
            OPT_IN="0"
            PUBLICATION_DATE="2010-01-01 11:06:00.0"
            START_DATE="2010-01-01 11:06:00.0"
            STATUS_NAME="ACTIVE"
            TEST="0"
            CAMPAIGN_ID="10003"
            />

    <CAMPAIGN
            CAMPAIGN_ID="10004"
            CASINO_ID="81004"
            CASINO_NAME="playtech81004"
            CATEGORY_ID="ACQUISITION"
            CREATED_BY="Denys_M"
            CREATED_DATE="2012-09-05 17:55:19.776"
            DERIVED_DATES="0"
            END_DATE="2020-01-01 00:00:00.0"
            LABEL="cmp4"
            NAME="Completed"
            PUBLICATION_DATE="2010-01-01 11:06:00.0"
            START_DATE="2019-02-04 01:00:00.0"
            STATUS_NAME="COMPLETED"
            UPDATED_BY="Denys_M"
            UPDATED_DATE="2012-09-05 17:59:04.818"
            />
    <ACTIVITY
            ACTIVITY_ID="11004"
            END_DATE="2020-01-01 00:00:00.0"
            LABEL="eb12ee5b-e96f-4347-8f03-23b3fb391a30"
            NAME="Activity 1"
            OPT_IN="0"
            PUBLICATION_DATE="2010-01-01 11:06:00.0"
            START_DATE="2019-02-04 01:00:00.0"
            STATUS_NAME="COMPLETED"
            TEST="0"
            CAMPAIGN_ID="10004"
            />
    <CAMPAIGN
            CAMPAIGN_ID="10005"
            CASINO_ID="81004"
            CASINO_NAME="playtech81004"
            CATEGORY_ID="ACQUISITION"
            CREATED_BY="Denys_M"
            CREATED_DATE="2012-09-05 17:55:19.776"
            DERIVED_DATES="0"
            END_DATE="2020-01-01 00:00:00.0"
            LABEL="cmp5"
            NAME="Disabled"
            PUBLICATION_DATE="2010-01-01 11:06:00.0"
            START_DATE="2010-01-01 11:06:00.0"
            STATUS_NAME="DISABLED"
            UPDATED_BY="Denys_M"
            UPDATED_DATE="2012-09-05 17:59:04.818"
            />
    <ACTIVITY
            ACTIVITY_ID="11005"
            END_DATE="2020-01-01 00:00:00.0"
            LABEL="eb12ee5b-e96f-4347-8f03-23b3fb391a30"
            NAME="Activity 1"
            OPT_IN="0"
            PUBLICATION_DATE="2010-01-01 11:06:00.0"
            START_DATE="2010-01-01 11:06:00.0"
            STATUS_NAME="DISABLED"
            TEST="0"
            CAMPAIGN_ID="10005"
            />
    <CAMPAIGN
            CAMPAIGN_ID="10006"
            CASINO_ID="81004"
            CASINO_NAME="playtech81004"
            CATEGORY_ID="ACQUISITION"
            CREATED_BY="Denys_M"
            CREATED_DATE="2012-09-05 17:55:19.776"
            DERIVED_DATES="0"
            END_DATE="2020-01-01 00:00:00.0"
            LABEL="cmp6"
            NAME="Paused"
            PUBLICATION_DATE="2012-08-29 13:41:00.0"
            START_DATE="2010-01-01 11:06:00.0"
            STATUS_NAME="PAUSED"
            UPDATED_BY="Denys_M"
            UPDATED_DATE="2012-09-05 17:59:04.818"
            />
    <ACTIVITY
            ACTIVITY_ID="11006"
            END_DATE="2020-01-01 00:00:00.0"
            LABEL="eb12ee5b-e96f-4347-8f03-23b3fb391a30"
            NAME="Activity 1"
            OPT_IN="0"
            PUBLICATION_DATE="2012-08-29 13:41:00.0"
            START_DATE="2010-01-01 11:06:00.0"
            STATUS_NAME="PAUSED"
            TEST="0"
            CAMPAIGN_ID="10006"
            />
    <CAMPAIGN
            CAMPAIGN_ID="10007"
            CASINO_ID="81004"
            CASINO_NAME="playtech81004"
            CATEGORY_ID="ACQUISITION"
            CREATED_BY="Denys_M"
            CREATED_DATE="2012-09-05 17:55:19.776"
            DERIVED_DATES="0"
            END_DATE="2020-01-01 00:00:00.0"
            LABEL="cmp7"
            NAME="Pending Approval"
            PUBLICATION_DATE="2012-08-29 13:41:00.0"
            START_DATE="2010-01-01 11:06:00.0"
            STATUS_NAME="PENDING_APPROVAL"
            UPDATED_BY="Denys_M"
            UPDATED_DATE="2012-09-05 17:59:04.818"
            />
    <ACTIVITY
            ACTIVITY_ID="11007"
            END_DATE="2020-01-01 00:00:00.0"
            LABEL="eb12ee5b-e96f-4347-8f03-23b3fb391a30"
            NAME="Activity 1"
            OPT_IN="0"
            PUBLICATION_DATE="2012-08-29 13:41:00.0"
            START_DATE="2010-01-01 11:06:00.0"
            STATUS_NAME="PENDING_APPROVAL"
            TEST="0"
            CAMPAIGN_ID="10007"
            />
</dataset>
