<?xml version='1.0' encoding='UTF-8'?>
<!DOCTYPE dataset SYSTEM "dbunit-dataset.dtd">
<dataset>
    <CAMPAIGN
            CAMPAIGN_ID="10001"
            CASINO_ID="81004"
            CASINO_NAME="playtech81004"
            CATEGORY_ID="ACQUISITION"
            CREATED_BY="Denys_M"
            CREATED_DATE="2012-09-05 17:55:19.776"
            DERIVED_DATES="0"
            END_DATE="2020-01-01 00:00:00.0"
            LABEL="cmp1"
            NAME="name1"
            PUBLICATION_DATE="2010-01-01 11:06:00.0"
            START_DATE="2010-01-01 11:06:00.0"
            STATUS_NAME="IN_DESIGN"
            UPDATED_BY="Denys_M"
            UPDATED_DATE="2012-09-05 17:59:04.818"
            />
    <ACTIVITY
            ACTIVITY_ID="11001"
            END_DATE="2020-01-01 00:00:00.0"
            LABEL="eb12ee5b-e96f-4347-8f03-23b3fb391a30"
            NAME="Activity 1"
            OPT_IN="0"
            PUBLICATION_DATE="2010-01-01 11:06:00.0"
            START_DATE="2010-01-01 11:06:00.0"
            STATUS_NAME="IN_DESIGN"
            TEST="0"
            CAMPAIGN_ID="10001"
            />
    <TAG
            TAG_ID="12001"
            VALUE="TagValue"
            CAMPAIGN_ID="10001"/>
    <CAMPAIGN
            CAMPAIGN_ID="10002"
            CASINO_ID="81004"
            CASINO_NAME="playtech81004"
            CATEGORY_ID="ACQUISITION"
            CREATED_BY="Denys_M"
            CREATED_DATE="2012-09-05 17:55:19.776"
            DERIVED_DATES="0"
            END_DATE="2020-01-01 00:00:00.0"
            LABEL="cmp2"
            NAME="name2"
            PUBLICATION_DATE="2010-01-01 11:06:00.0"
            START_DATE="2010-01-01 11:06:00.0"
            STATUS_NAME="IN_DESIGN"
            UPDATED_BY="Denys_M"
            UPDATED_DATE="2012-09-05 17:59:04.818"
            />
    <ACTIVITY
            ACTIVITY_ID="11002"
            END_DATE="2020-01-01 00:00:00.0"
            LABEL="eb12ee5b-e96f-4347-8f03-23b3fb391a30"
            NAME="Activity 1"
            OPT_IN="0"
            PUBLICATION_DATE="2010-01-01 11:06:00.0"
            START_DATE="2010-01-01 11:06:00.0"
            STATUS_NAME="IN_DESIGN"
            TEST="0"
            CAMPAIGN_ID="10002"
            />
    <TAG
            TAG_ID="12002"
            VALUE="1234567890"
            CAMPAIGN_ID="10002"/>
    <CAMPAIGN
            CAMPAIGN_ID="10003"
            CASINO_ID="81004"
            CASINO_NAME="playtech81004"
            CATEGORY_ID="ACQUISITION"
            CREATED_BY="Denys_M"
            CREATED_DATE="2012-09-05 17:55:19.776"
            DERIVED_DATES="0"
            END_DATE="2020-01-01 00:00:00.0"
            LABEL="cmp3"
            NAME="name3"
            PUBLICATION_DATE="2010-01-01 11:06:00.0"
            START_DATE="2010-01-01 11:06:00.0"
            STATUS_NAME="IN_DESIGN"
            UPDATED_BY="Denys_M"
            UPDATED_DATE="2012-09-05 17:59:04.818"
            />
    <ACTIVITY
            ACTIVITY_ID="11003"
            END_DATE="2020-01-01 00:00:00.0"
            LABEL="eb12ee5b-e96f-4347-8f03-23b3fb391a30"
            NAME="Activity 1"
            OPT_IN="0"
            PUBLICATION_DATE="2010-01-01 11:06:00.0"
            START_DATE="2010-01-01 11:06:00.0"
            STATUS_NAME="IN_DESIGN"
            TEST="0"
            CAMPAIGN_ID="10003"
            />
    <TAG
            TAG_ID="12003"
            VALUE="!@#$%^*()_+=-?.>/"
            CAMPAIGN_ID="10003"/>
    <CAMPAIGN
            CAMPAIGN_ID="10004"
            CASINO_ID="81004"
            CASINO_NAME="playtech81004"
            CATEGORY_ID="ACQUISITION"
            CREATED_BY="Denys_M"
            CREATED_DATE="2012-09-05 17:55:19.776"
            DERIVED_DATES="0"
            END_DATE="2020-01-01 00:00:00.0"
            LABEL="cmp4"
            NAME="name4"
            PUBLICATION_DATE="2010-01-01 11:06:00.0"
            START_DATE="2010-01-01 11:06:00.0"
            STATUS_NAME="IN_DESIGN"
            UPDATED_BY="Denys_M"
            UPDATED_DATE="2012-09-05 17:59:04.818"
            />
    <ACTIVITY
            ACTIVITY_ID="11004"
            END_DATE="2020-01-01 00:00:00.0"
            LABEL="eb12ee5b-e96f-4347-8f03-23b3fb391a30"
            NAME="Activity 1"
            OPT_IN="0"
            PUBLICATION_DATE="2010-01-01 11:06:00.0"
            START_DATE="2010-01-01 11:06:00.0"
            STATUS_NAME="IN_DESIGN"
            TEST="0"
            CAMPAIGN_ID="10004"
            />
    <TAG
            TAG_ID="12004"
            VALUE="Search name123456!@#$%^(*()"
            CAMPAIGN_ID="10004"/>
    <CAMPAIGN
            CAMPAIGN_ID="10005"
            CASINO_ID="81004"
            CASINO_NAME="playtech81004"
            CATEGORY_ID="ACQUISITION"
            CREATED_BY="Denys_M"
            CREATED_DATE="2012-09-05 17:55:19.776"
            DERIVED_DATES="0"
            END_DATE="2020-01-01 00:00:00.0"
            LABEL="cmp5"
            NAME="name5"
            PUBLICATION_DATE="2010-01-01 11:06:00.0"
            START_DATE="2010-01-01 11:06:00.0"
            STATUS_NAME="IN_DESIGN"
            UPDATED_BY="Denys_M"
            UPDATED_DATE="2012-09-05 17:59:04.818"
            />
    <ACTIVITY
            ACTIVITY_ID="11005"
            END_DATE="2020-01-01 00:00:00.0"
            LABEL="eb12ee5b-e96f-4347-8f03-23b3fb391a30"
            NAME="Activity 1"
            OPT_IN="0"
            PUBLICATION_DATE="2010-01-01 11:06:00.0"
            START_DATE="2010-01-01 11:06:00.0"
            STATUS_NAME="IN_DESIGN"
            TEST="0"
            CAMPAIGN_ID="10005"
            />
    <TAG
            TAG_ID="12005"
            VALUE="&lt;script language='JavaScript'> alert('Добрый день') &lt;/script>"
            CAMPAIGN_ID="10005"/>
</dataset>
